{
  "$schema": "https://json-schema.org/draft/2020-12/schema",
  "$id": "https://schemas.logixs.internal/contracts/v1/scenario-fixture.schema.json",
  "title": "ContractScenarioFixtureV1",
  "type": "object",
  "additionalProperties": false,
  "required": ["scenario", "description", "inputs", "expected"],
  "properties": {
    "scenario": {
      "enum": [
        "success",
        "rejection",
        "boundary",
        "duplicate",
        "out_of_order",
        "correction",
        "revocation",
        "conflict"
      ]
    },
    "description": { "type": "string", "minLength": 1 },
    "inputs": { "type": "array", "minItems": 1, "items": { "type": "object" } },
    "expected": {
      "type": "object",
      "required": ["outcome"],
      "properties": {
        "outcome": {
          "enum": [
            "accepted",
            "rejected",
            "idempotent",
            "pending",
            "corrected",
            "revoked",
            "manual_review"
          ]
        },
        "errorCode": { "type": "string" },
        "appliedNodeCodes": {
          "type": "array",
          "items": { "$ref": "common.schema.json#/$defs/LifecycleNodeCode" }
        }
      }
    }
  }
}
