{"scenario":"conflict","description":"Same idempotency key with a different payload hash requires review.","inputs":[{"idempotencyKey":"sample-key","requestHash":"aaaaaaaaaaaaaaaaaaaaaaaaaaaaaaaaaaaaaaaaaaaaaaaaaaaaaaaaaaaaaaaa"},{"idempotencyKey":"sample-key","requestHash":"bbbbbbbbbbbbbbbbbbbbbbbbbbbbbbbbbbbbbbbbbbbbbbbbbbbbbbbbbbbbbbbb"}],"expected":{"outcome":"manual_review","errorCode":"IDEMPOTENCY_KEY_CONFLICT"}}
