{
  "scenario": "duplicate",
  "description": "Same event identifier and payload hash returns the existing result.",
  "inputs": [
    {
      "eventId": "11111111-1111-4111-8111-111111111111",
      "payloadHash": "aaaaaaaaaaaaaaaaaaaaaaaaaaaaaaaaaaaaaaaaaaaaaaaaaaaaaaaaaaaaaaaa"
    },
    {
      "eventId": "11111111-1111-4111-8111-111111111111",
      "payloadHash": "aaaaaaaaaaaaaaaaaaaaaaaaaaaaaaaaaaaaaaaaaaaaaaaaaaaaaaaaaaaaaaaa"
    }
  ],
  "expected": { "outcome": "idempotent" }
}
