{
  "scenario": "rejection",
  "description": "Estimated arrival cannot complete a lifecycle node.",
  "inputs": [
    {
      "eventCode": "arrived",
      "timeKind": "estimated",
      "confidenceState": "provisional"
    }
  ],
  "expected": {
    "outcome": "rejected",
    "errorCode": "LIFECYCLE_EVENT_NOT_STATE_EVIDENCE"
  }
}
